Article ID,Article URL,Title,Journal,Authors,Abstract,predict(84239:Include)
11100968,https://sysrev.com/p/70431/article/11100968,Survival with Olaparib in Metastatic Castration-Resistant Prostate Cancer.,The New England journal of medicine,"Hussain, M.; Mateo, J.; Fizazi, K.; Saad, F.; Shore, N.; Sandhu, S.; Chi, KN.; Sartor, O.; Agarwal, N.; Olmos, D.; Thiery-Vuillemin, A.; Twardowski, P.; Roubaud, G.; Özgüroğlu, M.; Kang, J.; Burgents, J.; Gresty, C.; Corcoran, C.; Adelman, CA.; de Bono, J.","BACKGROUND: We previously reported that olaparib led to significantly longer imaging-based progression-free survival than the physician's choice of enzalutamide or abiraterone among men with metastatic castration-resistant prostate cancer who had qualifying alterations in homologous recombination repair genes and whose disease had progressed during previous treatment with a next-generation hormonal agent. The results of the final analysis of overall survival have not yet been reported.

METHODS: In an open-label, phase 3 trial, we randomly assigned patients in a 2:1 ratio to receive olaparib (256 patients) or the physician's choice of enzalutamide or abiraterone plus prednisone as the control therapy (131 patients). Cohort A included 245 patients with at least one alteration in<i>BRCA1</i>,<i>BRCA2</i>, or<i>ATM</i>, and cohort B included 142 patients with at least one alteration in any of the other 12 prespecified genes. Crossover to olaparib was allowed after imaging-based disease progression for patients who met certain criteria. Overall survival in cohort A, a key secondary end point, was analyzed with the use of an alpha-controlled, stratified log-rank test at a data maturity of approximately 60%. The primary and other key secondary end points were reported previously.

RESULTS: The median duration of overall survival in cohort A was 19.1 months with olaparib and 14.7 months with control therapy (hazard ratio for death, 0.69; 95% confidence interval [CI], 0.50 to 0.97; P = 0.02). In cohort B, the median duration of overall survival was 14.1 months with olaparib and 11.5 months with control therapy. In the overall population (cohorts A and B), the corresponding durations were 17.3 months and 14.0 months. Overall, 86 of 131 patients (66%) in the control group crossed over to receive olaparib (56 of 83 patients [67%] in cohort A). A sensitivity analysis that adjusted for crossover to olaparib showed hazard ratios for death of 0.42 (95% CI, 0.19 to 0.91) in cohort A, 0.83 (95% CI, 0.11 to 5.98) in cohort B, and 0.55 (95% CI, 0.29 to 1.06) in the overall population.

CONCLUSIONS: Among men with metastatic castration-resistant prostate cancer who had tumors with at least one alteration in<i>BRCA1</i>,<i>BRCA2</i>, or<i>ATM</i>and whose disease had progressed during previous treatment with a next-generation hormonal agent, those who were initially assigned to receive olaparib had a significantly longer duration of overall survival than those who were assigned to receive enzalutamide or abiraterone plus prednisone as the control therapy, despite substantial crossover from control therapy to olaparib. (Funded by AstraZeneca and Merck Sharp and Dohme; PROfound ClinicalTrials.gov number, NCT02987543.).",0.465
11100969,https://sysrev.com/p/70431/article/11100969,Nivolumab Is Effective in Mismatch Repair-Deficient Noncolorectal Cancers: Results From Arm Z1D-A Subprotocol of the NCI-MATCH (EAY131) Study.,Journal of clinical oncology : official journal of the American Society of Clinical Oncology,"Azad, NS.; Gray, RJ.; Overman, MJ.; Schoenfeld, JD.; Mitchell, EP.; Zwiebel, JA.; Sharon, E.; Streicher, H.; Li, S.; McShane, LM.; Rubinstein, L.; Patton, DR.; Williams, PM.; Coffey, B.; Hamilton, SR.; Bahary, N.; Suga, JM.; Hatoum, H.; Abrams, JS.; Conley, BA.; Arteaga, CL.; Harris, L.; O'Dwyer, PJ.; Chen, AP.; Flaherty, KT.","PURPOSE: The National Cancer Institute Molecular Analysis for Therapy Choice (NCI-MATCH) trial, the largest national precision oncology study to date (> 1,100 sites) of patients with relapsed or refractory malignancies, assigned patients to targeted therapy in parallel phase II studies based on tumor molecular alterations. The anti-programmed death receptor 1 inhibitor nivolumab previously showed activity in mismatch repair (MMR)-deficient colon cancer. We hypothesized that nivolumab would have activity in patients with MMR-deficient, noncolorectal tumors.

PATIENTS AND METHODS: Eligible patients with relapsed or refractory tumors, good end-organ function, and Eastern Cooperative Oncology Group performance status of ≤ 1 underwent tumor biopsy for centralized screening of molecular alterations. MMR deficiency was defined by complete loss of nuclear expression of<i>MLH1</i>or<i>MSH2</i>MMR gene products by immunohistochemistry (IHC). Patients with MMR-deficient colorectal cancer were excluded. Nivolumab, 3 mg/kg every 2 weeks (28-day cycles) and 480 mg every 4 weeks after cycle 4, was administered intravenously. Disease reassessment was performed every 2 cycles. The primary end point was RECIST 1.1 objective response rate (ORR).

RESULTS: Two percent of 4,902 screened patients had an MMR-deficient cancer by IHC. Forty-two evaluable patients were enrolled, with a median age of 60 years and a median of 3 prior therapies. The most common histologies were endometrioid endometrial adenocarcinoma (n = 13), prostate adenocarcinoma (n = 5), and uterine carcinosarcoma (n = 4). ORR was 36% (15 of 42 patients). An additional 21% of patients had stable disease. The estimated 6-, 12-, and 18-month progression-free survival rates were 51.3% (90% CI, 38.2% to 64.5%), 46.2% (90% CI, 33.1% to 59.3%), and 31.4% (90% CI, 18.7% to 44.2%), respectively. Median overall survival was 17.3 months. Toxicity was predominantly low grade.

CONCLUSION: A variety of refractory cancers (2.0% of those screened) had MMR deficiency as defined in NCI-MATCH. Nivolumab has promising activity in MMR-deficient noncolorectal cancers of a wide variety of histopathologic types.",0.367
11128263,https://sysrev.com/p/70431/article/11128263,"Olaparib combined with abiraterone in patients with metastatic castration-resistant prostate cancer: a randomised, double-blind, placebo-controlled, phase 2 trial.",The Lancet. Oncology,"Clarke, N.; Wiechno, P.; Alekseev, B.; Sala, N.; Jones, R.; Kocak, I.; Chiuri, VE.; Jassem, J.; Fléchon, A.; Redfern, C.; Goessl, C.; Burgents, J.; Kozarski, R.; Hodgson, D.; Learoyd, M.; Saad, F.","BACKGROUND: Patients with metastatic castration-resistant prostate cancer and homologous recombination repair (HRR) mutations have a better response to treatment with the poly(ADP-ribose) polymerase inhibitor olaparib than patients without HRR mutations. Preclinical data suggest synergy between olaparib and androgen pathway inhibitors. We aimed to assess the efficacy of olaparib plus the androgen pathway inhibitor abiraterone in patients with metastatic castration-resistant prostate cancer regardless of HRR mutation status.

METHODS: We carried out this double-blind, randomised, placebo-controlled phase 2 trial at 41 urological oncology sites in 11 countries across Europe and North America. Eligible male patients were aged 18 years or older with metastatic castration-resistant prostate cancer who had previously received docetaxel and were candidates for abiraterone treatment. Patients were excluded if they had received more than two previous lines of chemotherapy, or had previous exposure to second-generation antihormonal drugs. Patients were randomly assigned (1:1) using an interactive voice or web response system, without stratification, to receive oral olaparib 300 mg twice daily or placebo. All patients received oral abiraterone 1000 mg once daily and prednisone or prednisolone 5 mg twice daily. Patients and investigators were masked to treatment allocation. The primary endpoint was investigator-assessed radiographic progression-free survival (rPFS; based on Response Evaluation Criteria in Solid Tumors version 1.1 and Prostate Cancer Clinical Trials Working Group 2 criteria). Efficacy analyses were done in the intention-to-treat population, which included all randomly assigned patients, and safety analyses included all patients who received at least one dose of olaparib or placebo. This trial is registered with ClinicalTrials.gov, number NCT01972217, and is no longer recruiting patients.

FINDINGS: Between Nov 25, 2014, and July 14, 2015, 171 patients were assessed for eligibility. Of those, 142 patients were randomly assigned to receive olaparib and abiraterone (n=71) or placebo and abiraterone (n=71). The clinical cutoff date for the final analysis was Sept 22, 2017. Median rPFS was 13·8 months (95% CI 10·8-20·4) with olaparib and abiraterone and 8·2 months (5·5-9·7) with placebo and abiraterone (hazard ratio [HR] 0·65, 95% CI 0·44-0·97, p=0·034). The most common grade 1-2 adverse events were nausea (26 [37%] patients in the olaparib group vs 13 [18%] patients in the placebo group), constipation (18 [25%] vs eight [11%]), and back pain (17 [24%] vs 13 [18%]). 38 (54%) of 71 patients in the olaparib and abiraterone group and 20 (28%) of 71 patients in the placebo and abiraterone group had grade 3 or worse adverse events, including anaemia (in 15 [21%] of 71 patients vs none of 71), pneumonia (four [6%] vs three [4%]), and myocardial infarction (four [6%] vs none). Serious adverse events were reported by 24 (34%) of 71 patients receiving olaparib and abiraterone (seven of which were related to treatment) and 13 (18%) of 71 patients receiving placebo and abiraterone (one of which was related to treatment). One treatment-related death (pneumonitis) occurred in the olaparib and abiraterone group.

INTERPRETATION: Olaparib in combination with abiraterone provided clinical efficacy benefit for patients with metastatic castration-resistant prostate cancer compared with abiraterone alone. More serious adverse events were observed in patients who received olaparib and abiraterone than abiraterone alone. Our data suggest that the combination of olaparib and abiraterone might provide an additional clinical benefit to a broad population of patients with metastatic castration-resistant prostate cancer.

FUNDING: AstraZeneca.",0.465
11380555,https://sysrev.com/p/70431/article/11380555,Effect of Osimertinib and Bevacizumab on Progression-Free Survival for Patients With Metastatic EGFR-Mutant Lung Cancers: A Phase 1/2 Single-Group Open-Label Trial.,JAMA oncology,"Yu, HA.; Schoenfeld, AJ.; Makhnin, A.; Kim, R.; Rizvi, H.; Tsui, D.; Falcon, C.; Houck-Loomis, B.; Meng, F.; Yang, JL.; Tobi, Y.; Heller, G.; Ahn, L.; Hayes, SA.; Young, RJ.; Arcila, ME.; Berger, M.; Chaft, JE.; Ladanyi, M.; Riely, GJ.; Kris, MG.","Importance: The combination of erlotinib and bevacizumab as initial treatment of epidermal growth factor receptor (EGFR [OMIM 131550])-mutant lung cancers improves progression-free survival (PFS) compared with erlotinib alone. Because osimertinib prolongs PFS compared with erlotinib, this trial was designed to study the combination of osimertinib and bevacizumab as first-line treatment.Objectives: To determine the safety and tolerability of osimertinib and bevacizumab combination treatment and assess the 12-month PFS of the combination in patients with metastatic EGFR-mutant lung cancers.Design, Setting, and Particiants: From August 15, 2016, to May 15, 2018, 49 patients with metastatic EGFR-mutant lung cancers were enrolled in this interventional clinical trial, conducted at a single academic cancer center. In the phase 1 portion of the study, a standard 3 + 3 dose de-escalation design was used to determine the maximum tolerated dose of osimertinib and bevacizumab. In the phase 2 portion of the study, patients were treated at the maximum tolerated dose defined in the phase 1 portion. Statistical analysis was performed from August 1 to October 1, 2019.Interventions: All patients received osimertinib, 80 mg daily, and bevacizumab, 15 mg/kg once every 3 weeks.Main Outcomes and Measures: The primary objective of the phase 2 portion of the study was to determine the number of patients receiving the combination of osimertinib and bevacizumab who were progression free at 12 months. Secondary end points included overall response rate, median PFS, overall survival, and definition of the toxic effects of the combination treatment.Results: Among the 49 patients in the study (34 women; median age, 60 years [range, 36-83 years]), PFS at 12 months was 76% (95% CI, 65%-90%). The overall response rate was 80% (95% CI, 67%-91%), and median PFS was 19 months (95% CI, 15-24 months). Of the 6 patients with measurable central nervous system disease, all had a partial or complete central nervous system response. Persistent detection of EGFR-mutant circulating tumor (ct)DNA at 6 weeks was associated with shorter median PFS (clearance at 6 weeks, 16.2 months [95% CI, 13 months to not reached]; and no clearance at 6 weeks, 9.8 months [95% CI, 4 months to not reached]; P = .04) and median overall survival (clearance at 6 weeks, not reached; and no clearance at 6 weeks, 10.1 months [95% CI, 6 months to not reached]; P = .002). Identified mechanisms of resistance included squamous cell transformation (n = 2) pleomorphic transformation (n = 1), and acquired EGFR L718Q (n = 1) and C797S (n = 1) mutations.Conclusions and Relevance: The combination of osimertinib and bevacizumab met the study's prespecified effectiveness end point. Persistent EGFR-mutant circulating tumor DNA at 6 weeks was associated with early progression and shorter survival. A randomized phase 3 study comparing osimertinib and bevacizumab with osimertinib alone is planned.Trial Registration: ClinicalTrials.gov Identifier: NCT02803203.",0.592
11380556,https://sysrev.com/p/70431/article/11380556,Docetaxel plus oral metronomic cyclophosphamide: a phase II study with pharmacodynamic and pharmacogenetic analyses in castration-resistant prostate cancer patients.,Cancer,"Derosa, L.; Galli, L.; Orlandi, P.; Fioravanti, A.; Di Desidero, T.; Fontana, A.; Antonuzzo, A.; Biasco, E.; Farnesi, A.; Marconcini, R.; Francia, G.; Danesi, R.; Falcone, A.; Bocci, G.","BACKGROUND: Docetaxel plus prednisone is currently the standard first-line treatment in metastatic castration-resistant prostate cancer (mCRPC). The aim of this study was to assess the clinical activity and pharmacodynamic/pharmacogenetic profile of docetaxel plus prednisone in combination with metronomic cyclophosphamide in mCRPC patients.METHODS: Forty-one chemotherapy-naive patients received docetaxel (60 mg/m(2) intravenously every 3 weeks up to 12 cycles) and, from day 2, prednisone 10 mg/day, celecoxib 400 mg/day, and metronomic cyclophosphamide 50 mg/day, continuously. Plasma VEGF and bFGF were detected by ELISA. Real-time PCR-SNP analysis of VEGF gene was performed using an ABI PRISM 7900HT SDS and TaqMan SNP genotyping.RESULTS: Eighty-seven percent of patients were free of progression at 6 months. A decrease in prostate-specific antigen ≥50% was observed in 82% of 39 evaluable patients, with a median time to progression of 12.3 months. Grade 3 adverse events were neutropenia (5%), thrombocytopenia, diarrhea, and stomatitis (2.5%). Median PFS and OS were 14.9 months (95% CI, 9.2-15.3 months) and 33.3 months (95% CI, 23-35.6 months), respectively. Of 11 patients (28%) with evaluable disease, 5 (44%) achieved a complete response, 2 (11%) a partial response, and 2 (11%) stable disease, whereas 2 showed disease progression. The -1154A/G VEGF polymorphism, plasma VEGF, and bFGF after the first cycle of chemotherapy may represent useful pharmacodynamic markers to predict better outcomes.CONCLUSIONS: The combination of docetaxel and oral metronomic chemotherapy is effective and well tolerated in mCRPC patients and may deserve further evaluation.",0.475
11380557,https://sysrev.com/p/70431/article/11380557,Association of Tissue Abiraterone Levels and ,Clinical cancer research : an official journal of the American Association for Cancer Research,"Mostaghel, EA.; Cho, E.; Zhang, A.; Alyamani, M.; Kaipainen, A.; Green, S.; Marck, BT.; Sharifi, N.; Wright, JL.; Gulati, R.; True, LD.; Loda, M.; Matsumoto, AM.; Tamae, D.; Penning, TN.; Balk, SP.; Kantoff, PW.; Nelson, PS.; Taplin, ME.; Montgomery, RB.","<b>Purpose:</b>Germline variation in solute carrier organic anion (<i>SLCO</i>) genes influences cellular steroid uptake and is associated with prostate cancer outcomes. We hypothesized that, due to its steroidal structure, the CYP17A inhibitor abiraterone may undergo transport by<i>SLCO</i>-encoded transporters and that<i>SLCO</i>gene variation may influence intracellular abiraterone levels and outcomes.<b>Experimental Design:</b>Steroid and abiraterone levels were measured in serum and tissue from 58 men with localized prostate cancer in a clinical trial of LHRH agonist plus abiraterone acetate plus prednisone for 24 weeks prior to prostatectomy. Germline DNA was genotyped for 13 SNPs in six<i>SLCO</i>genes.<b>Results:</b>Abiraterone levels spanned a broad range (serum median 28 ng/mL, 108 nmol/L; tissue median 77 ng/mL, 271 nmol/L) and were correlated (<i>r</i>= 0.355,<i>P</i>= 0.001). Levels correlated positively with steroids upstream of CYP17A (pregnenolone, progesterone), and inversely with steroids downstream of CYP17A (DHEA, AED, testosterone). Serum PSA and tumor volumes were higher in men with undetectable versus detectable tissue abiraterone at prostatectomy (median 0.10 vs. 0.03 ng/dL,<i>P</i>= 0.02; 1.28 vs. 0.44 cc,<i>P</i>= 0.09, respectively). SNPs in<i>SLCO2B1</i>associated with significant differences in tissue abiraterone (rs1789693,<i>P</i>= 0.0008; rs12422149,<i>P</i>= 0.03) and higher rates of minimal residual disease (tumor volume < 0.5 cc; rs1789693, 67% vs. 27%,<i>P</i>= 0.009; rs1077858, 46% vs. 0%,<i>P</i>= 0.03). LNCaP cells expressing SLCO2B1 showed two- to fourfold higher abiraterone levels compared with vector controls (<i>P</i>< 0.05).<b>Conclusions:</b>Intraprostatic abiraterone levels and genetic variation in<i>SLCO</i>genes are associated with pathologic responses in high-risk localized prostate cancer. Variation in<i>SLCO</i>genes may serve as predictors of response to abiraterone treatment.<i>Clin Cancer Res; 23(16); 4592-601. ©2017 AACR</i>.",0.259
11380558,https://sysrev.com/p/70431/article/11380558,p53 alteration in regional lymph node metastases from prostate carcinoma: a marker for progression?,Cancer,"Cheng, L.; Leibovich, BC.; Bergstralh, EJ.; Scherer, BG.; Pacelli, A.; Ramnani, DM.; Zincke, H.; Bostwick, DG.","BACKGROUND: Alterations of the p53 tumor suppressor gene are associated with advanced stage prostate carcinoma. The biologic significance of p53 nuclear accumulation in prostate cancer patients with regional lymph node metastases is uncertain.METHODS: The authors investigated p53 alterations by immunohistochemistry in 220 lymph node positive patients who were treated with radical prostatectomy, bilateral pelvic lymphadenectomy, and androgen deprivation therapy between 1987-1992 at the Mayo Clinic. The mean follow-up was 6.3 years. Tumor volume of lymph node metastases was measured using the grid method.RESULTS: p53 immunoreactivity was detected in 109 of 211 primary tumors (52%) and 83 of 144 matched regional lymph node metastases (58%); this expression was strongly concordant (correlation coefficient 0.53; P = 0.0001). Overexpression of p53 protein in lymph node metastases was associated with distant metastasis free survival by univariate analysis (P = 0.03), but did not reach statistical significance by multivariate analysis (P = 0.07). Regional lymph node cancer volume was the single most important predictor of distant metastases after adjusting for Gleason score, DNA ploidy, and p53 expression.CONCLUSIONS: The findings of the current study suggest that assessment of biologic changes (including p53 alterations in regional lymph node metastases) could be of value in the assessment of the biologic aggressiveness of prostate carcinoma, whereas p53 expression in the primary tumor does not appear to influence patient outcome.",0.308
11380559,https://sysrev.com/p/70431/article/11380559,"A randomized, double-blind, placebo-controlled study of the effects of pomegranate extract on rising PSA levels in men following primary therapy for prostate cancer.",Prostate cancer and prostatic diseases,"Pantuck, AJ.; Pettaway, CA.; Dreicer, R.; Corman, J.; Katz, A.; Ho, A.; Aronson, W.; Clark, W.; Simmons, G.; Heber, D.","BACKGROUND: The primary objective of this study was to compare the effects of pomegranate juice on PSA doubling times (PSADT) in subjects with rising PSA levels after primary therapy for prostate cancer.METHODS: Double-blind, placebo-controlled multi-institutional study, evaluated the effects of pomegranate liquid extract on serum PSA levels. The primary end point of this study was change in serum PSADT. Additional secondary and exploratory objectives were to evaluate the safety of pomegranate juice and to determine the interaction of manganese superoxide dismutase (MnSOD) AA genotype and pomegranate treatment on PSADT.RESULTS: One-hundred eighty-three eligible subjects were randomly assigned to the active and placebo groups with a ratio of 2:1 (extract N=102; placebo N=64; juice N=17). The majority of adverse events were of moderate or mild grade. Median PSADT increased from 11.1 months at baseline to 15.6 months in the placebo group (P<0.001) compared with an increase from 12.9 months at baseline to 14.5 months in the extract group (P=0.13) and an increase from 12.7 at baseline to 20.3 in the juice group (P=0.004). However, none of these changes were statistically significant between the three groups (P>0.05). Placebo AA patients experienced a 1.8 month change in median PSADT from 10.9 months at baseline to 12.7 months (P=0.22), while extract patients experienced a 12 month change in median PSADT from 13.6 at baseline to 25.6 months (P=0.03).CONCLUSIONS: Compared with placebo, pomegranate extract did not significantly prolong PSADT in prostate cancer patients with rising PSA after primary therapy. A significant prolongation in PSADT was observed in both the treatment and placebo arms. Men with the MnSOD AA genotype may represent a group that is more sensitive to the antiproliferative effects of pomegranate on PSADT; however, this finding requires prospective hypothesis testing and validation.",0.196
11380560,https://sysrev.com/p/70431/article/11380560,Genetic variants of the Wnt signaling pathway as predictors of aggressive disease and reclassification in men with early stage prostate cancer on active surveillance.,Carcinogenesis,"Shu, X.; Ye, Y.; Gu, J.; He, Y.; Davis, JW.; Thompson, TC.; Logothetis, CJ.; Kim, J.; Wu, X.","Little is known about the genetic predictors of prostate cancer aggressiveness and reclassification in men with localized prostate cancer undergoing active surveillance. The Wnt signaling pathway is important for prostate cancer development and progression. Identifying genetic variants associated with prostate cancer aggressiveness and reclassification may have a potential role in the management of localized patients. In this study, we used a three-phase design. In phases I and II prostate cancer patient cohort, 578 single nucleotide polymorphisms (SNPs) from 45 genes of the Wnt signaling pathway were analyzed in 1762 localized prostate cancer patients. Twelve SNPs from four regions were significantly associated with aggressive disease, among which, three linked SNPs in CSNK1A1 at 5q32 (represented by rs752822) may differentiate GS 4+3 from GS 3+4 patients (OR = 1.44, 95% CI = 1.12-1.87, P = 4.76×10(-3)). In phase III active surveillance (AS) cohort, genotyping of rs752822 (candidate from phases I and II) and previously identified rs2735839 were determined in 494 GS ≤7 patients. We found a significant association between rs2735839 and prostate cancer reclassification in the AS cohort (AG + AA versus GG, HR = 1.59, 95% CI = 1.11-2.28, P = 0.012) and a suggestive association of rs752822. Jointly, rs752822 and rs2735839 showed good potentials in risk-stratifying GS 7 patients and predicting disease reclassification (OR = 2.71, 95% CI = 1.62-4.51, P = 1×10(-4) in phase II; HR = 1.89, 95% CI = 1.13-3.18, P = 0.016 in phase III). In summary, rs752822 and rs2735839 may assist in risk-stratifying GS 7 patients and predict prostate cancer reclassification. The significant associations were independent from GS, T stage and PSA levels at baseline.",0.241
