Article ID,Article URL,Title,Journal,Authors,Abstract,predict(84239:Include)
11100932,https://sysrev.com/p/70431/article/11100932,Prospective Multicenter Validation of Androgen Receptor Splice Variant 7 and Hormone Therapy Resistance in High-Risk Castration-Resistant Prostate Cancer: The PROPHECY Study.,Journal of clinical oncology : official journal of the American Society of Clinical Oncology,"Armstrong, AJ.; Halabi, S.; Luo, J.; Nanus, DM.; Giannakakou, P.; Szmulewitz, RZ.; Danila, DC.; Healy, P.; Anand, M.; Rothwell, CJ.; Rasmussen, J.; Thornburg, B.; Berry, WR.; Wilder, RS.; Lu, C.; Chen, Y.; Silberstein, JL.; Kemeny, G.; Galletti, G.; Somarelli, JA.; Gupta, S.; Gregory, SG.; Scher, HI.; Dittamore, R.; Tagawa, ST.; Antonarakis, ES.; George, DJ.","PURPOSE: Androgen receptor splice variant 7 (AR-V7) results in a truncated receptor, which leads to ligand-independent constitutive activation that is not inhibited by anti-androgen therapies, including abiraterone or enzalutamide. Given that previous reports suggested that circulating tumor cell (CTC) AR-V7 detection is a poor prognostic indicator for the clinical efficacy of secondary hormone therapies, we conducted a prospective multicenter validation study.

PATIENTS AND METHODS: PROPHECY ( ClinicalTrials.gov identifier: NCT02269982) is a multicenter, prospective-blinded study of men with high-risk mCRPC starting abiraterone acetate or enzalutamide treatment. The primary objective was to validate the prognostic significance of baseline CTC AR-V7 on the basis of radiographic or clinical progression free-survival (PFS) by using the Johns Hopkins University modified-AdnaTest CTC AR-V7 mRNA assay and the Epic Sciences CTC nuclear-specific AR-V7 protein assay. Overall survival (OS) and prostate-specific antigen responses were secondary end points.

RESULTS: We enrolled 118 men with mCRPC who were starting abiraterone or enzalutamide treatment. AR-V7 detection by both the Johns Hopkins and Epic AR-V7 assays was independently associated with shorter PFS (hazard ratio, 1.9 [95% CI, 1.1 to 3.3;<i>P</i>= .032] and 2.4 [95% CI, 1.1 to 5.1;<i>P</i>= .020], respectively) and OS (hazard ratio, 4.2 [95% CI, 2.1 to 8.5] and 3.5 [95% CI, 1.6 to 8.1], respectively) after adjusting for CTC number and clinical prognostic factors. Men with AR-V7-positive mCRPC had fewer confirmed prostate-specific antigen responses (0% to 11%) or soft tissue responses (0% to 6%). The observed percentage agreement between the two AR-V7 assays was 82%.

CONCLUSION: Detection of AR-V7 in CTCs by two blood-based assays is independently associated with shorter PFS and OS with abiraterone or enzalutamide, and such men with mCRPC should be offered alternative treatments.",0.570
11100933,https://sysrev.com/p/70431/article/11100933,Androgen Receptor Burden and Poor Response to Abiraterone or Enzalutamide in TP53 Wild-Type Metastatic Castration-Resistant Prostate Cancer.,JAMA oncology,"De Laere, B.; Rajan, P.; Grönberg, H.; Dirix, L.; Lindberg, J.",,0.382
11100934,https://sysrev.com/p/70431/article/11100934,A Phase II Trial of the Aurora Kinase A Inhibitor Alisertib for Patients with Castration-resistant and Neuroendocrine Prostate Cancer: Efficacy and Biomarkers.,Clinical cancer research : an official journal of the American Association for Cancer Research,"Beltran, H.; Oromendia, C.; Danila, DC.; Montgomery, B.; Hoimes, C.; Szmulewitz, RZ.; Vaishampayan, U.; Armstrong, AJ.; Stein, M.; Pinski, J.; Mosquera, JM.; Sailer, V.; Bareja, R.; Romanel, A.; Gumpeni, N.; Sboner, A.; Dardenne, E.; Puca, L.; Prandi, D.; Rubin, MA.; Scher, HI.; Rickman, DS.; Demichelis, F.; Nanus, DM.; Ballman, KV.; Tagawa, ST.","PURPOSE: Neuroendocrine prostate cancer (NEPC) is an aggressive variant of prostate cancer that may develop<i>de novo</i>or as a mechanism of treatment resistance. N-myc is capable of driving NEPC progression. Alisertib inhibits the interaction between N-myc and its stabilizing factor Aurora-A, inhibiting N-myc signaling, and suppressing tumor growth.

PATIENTS AND METHODS: Sixty men were treated with alisertib 50 mg twice daily for 7 days every 21 days. Eligibility included metastatic prostate cancer and at least one: small-cell neuroendocrine morphology; ≥50% neuroendocrine marker expression; new liver metastases without PSA progression; or elevated serum neuroendocrine markers. The primary endpoint was 6-month radiographic progression-free survival (rPFS). Pretreatment biopsies were evaluated by whole exome and RNA-seq and patient-derived organoids were developed.

RESULTS: Median PSA was 1.13 ng/mL (0.01-514.2), number of prior therapies was 3, and 68% had visceral metastases. Genomic alterations involved<i>RB1</i>(55%),<i>TP53</i>(46%),<i>PTEN</i>(29%),<i>BRCA2</i>(29%), and<i>AR</i>(27%), and there was a range of androgen receptor signaling and NEPC marker expression. Six-month rPFS was 13.4% and median overall survival was 9.5 months (7.3-13). Exceptional responders were identified, including complete resolution of liver metastases and prolonged stable disease, with tumors suggestive of N-myc and Aurora-A overactivity. Patient organoids exhibited concordant responses to alisertib and allowed for the dynamic testing of Aurora-N-myc complex disruption.

CONCLUSIONS: Although the study did not meet its primary endpoint, a subset of patients with advanced prostate cancer and molecular features supporting Aurora-A and N-myc activation achieved significant clinical benefit from single-agent alisertib.",0.221
11100935,https://sysrev.com/p/70431/article/11100935,Expression of AR-V7 and ARv,Clinical cancer research : an official journal of the American Association for Cancer Research,"Tagawa, ST.; Antonarakis, ES.; Gjyrezi, A.; Galletti, G.; Kim, S.; Worroll, D.; Stewart, J.; Zaher, A.; Szatrowski, TP.; Ballman, KV.; Kita, K.; Tasaki, S.; Bai, Y.; Portella, L.; Kirby, BJ.; Saad, F.; Eisenberger, MA.; Nanus, DM.; Giannakakou, P.","PURPOSE: Biomarkers aiding treatment optimization in metastatic castration-resistant prostate cancer (mCRPC) are scarce. The presence or absence of androgen receptor (AR) splice variants, AR-V7 and AR<sup>v567es</sup>, in mCRPC patient circulating tumor cells (CTC) may be associated with taxane treatment outcomes.<b>Experimental Design:</b>A novel digital droplet PCR (ddPCR) assay assessed AR-splice variant expression in CTCs from patients receiving docetaxel or cabazitaxel in TAXYNERGY (NCT01718353). Patient outcomes were examined according to AR-splice variant expression, including prostate-specific antigen (PSA)<sub>50</sub>response and progression-free survival (PFS).

RESULTS: Of the 54 evaluable patients, 36 (67%) were AR-V7<sup>+</sup>, 42 (78%) were AR<sup>v567es+</sup>, 29 (54%) were double positive, and 5 (9%) were double negative. PSA<sub>50</sub>response rates at any time were numerically higher for AR-V7<sup>-</sup>versus AR-V7<sup>+</sup>(78% vs. 58%;<i>P</i>= 0.23) and for AR<sup>v567es-</sup>versus AR<sup>v567es+</sup>(92% vs. 57%;<i>P</i>= 0.04) patients. When AR-V mRNA status was correlated with change in nuclear AR from cycle 1 day 1 to day 8 (<i>n</i>= 24), AR-V7<sup>+</sup>patients (<i>n</i>= 16) had a 0.4% decrease versus a 12.9% and 26.7% decrease in AR-V7<sup>-</sup>/AR<sup>v567es-</sup>(<i>n</i>= 3) and AR-V7<sup>-</sup>/AR<sup>v567es+</sup>(<i>n</i>= 5) patients, respectively, suggesting a dominant role for AR-V7 over AR<sup>v567es</sup>. Median PFS was 12.02 versus 8.48 months for AR-V7<sup>-</sup>versus AR-V7<sup>+</sup>(HR = 0.38;<i>P</i>= 0.01), and 12.71 versus 7.29 months for AR<sup>v567es-</sup>versus AR<sup>v567es+</sup>(HR = 0.37;<i>P</i>= 0.02). For AR-V7<sup>+</sup>, AR-V7<sup>-</sup>/AR<sup>v567es+</sup>, and AR-V7<sup>-</sup>/AR<sup>v567es-</sup>patients, median PFS was 8.48, 11.17, and 16.62 months, respectively (<i>P</i>= 0.0013 for trend).

CONCLUSIONS: Although detection of both CTC-specific AR-V7 and AR<sup>v567es</sup>by ddPCR influenced taxane outcomes, AR-V7 primarily mediated the prognostic impact. The absence of both variants was associated with the best response and PFS with taxane treatment.See related commentary by Dehm et al., p. 1696.",0.591
11100936,https://sysrev.com/p/70431/article/11100936,Stereotactic ablative radiotherapy for the comprehensive treatment of 4-10 oligometastatic tumors (SABR-COMET-10): study protocol for a randomized phase III trial.,BMC cancer,"Palma, DA.; Olson, R.; Harrow, S.; Correa, RJM.; Schneiders, F.; Haasbeek, CJA.; Rodrigues, GB.; Lock, M.; Yaremko, BP.; Bauman, GS.; Ahmad, B.; Schellenberg, D.; Liu, M.; Gaede, S.; Laba, J.; Mulroy, L.; Senthi, S.; Louie, AV.; Swaminath, A.; Chalmers, A.; Warner, A.; Slotman, BJ.; de Gruijl, TD.; Allan, A.; Senan, S.","BACKGROUND: Stereotactic ablative radiotherapy (SABR) has emerged as a new treatment option for patients with oligometastatic disease. SABR delivers precise, high-dose, hypofractionated radiotherapy, and achieves excellent rates of local control for primary tumors or metastases. A recent randomized phase II trial evaluated SABR in a group of patients with a small burden of oligometastatic disease (mostly with 1-3 metastatic lesions), and found that SABR was associated with benefits in progression-free survival and overall survival. The goal of this phase III trial is to assess the impact of SABR in patients with 4-10 metastatic cancer lesions.

METHODS: One hundred and fifty-nine patients will be randomized in a 1:2 ratio between the control arm (consisting of standard of care palliative-intent treatments), and the SABR arm (consisting of standard of care treatment + SABR to all sites of known disease). Randomization will be stratified by two factors: histology (Group 1: prostate, breast, or renal; Group 2: all others), and type of pre-specified systemic therapy (Group 1: immunotherapy/targeted; Group 2: cytotoxic; Group 3: observation). SABR is to be completed within 2 weeks, allowing for rapid initiation of systemic therapy. Recommended SABR doses are 20 Gy in 1 fraction, 30 Gy in 3 fractions, or 35 Gy in 5 fractions, chosen to minimize risks of toxicity. The primary endpoint is overall survival, and secondary endpoints include progression-free survival, time to development of new metastatic lesions, quality of life, and toxicity. Translational endpoints include assessment of circulating tumor cells, cell-free DNA, and tumor tissue as prognostic and predictive markers, including assessment of immunological predictors of response and long-term survival.

DISCUSSION: This study will provide an assessment of the impact of SABR on clinical outcomes and quality of life, to determine if long-term survival can be achieved for selected patients with 4-10 oligometastatic lesions.

TRIAL REGISTRATION: Clinicaltrials.gov identifier: NCT03721341 . Date of registration: October 26, 2018.",0.281
11100937,https://sysrev.com/p/70431/article/11100937,Androgen Receptor Variant AR-V9 Is Coexpressed with AR-V7 in Prostate Cancer Metastases and Predicts Abiraterone Resistance.,Clinical cancer research : an official journal of the American Association for Cancer Research,"Kohli, M.; Ho, Y.; Hillman, DW.; Van Etten, JL.; Henzler, C.; Yang, R.; Sperger, JM.; Li, Y.; Tseng, E.; Hon, T.; Clark, T.; Tan, W.; Carlson, RE.; Wang, L.; Sicotte, H.; Thai, H.; Jimenez, R.; Huang, H.; Vedell, PT.; Eckloff, BW.; Quevedo, JF.; Pitot, HC.; Costello, BA.; Jen, J.; Wieben, ED.; Silverstein, KAT.; Lang, JM.; Wang, L.; Dehm, SM.","<b>Purpose:</b>Androgen receptor (AR) variant AR-V7 is a ligand-independent transcription factor that promotes prostate cancer resistance to AR-targeted therapies. Accordingly, efforts are under way to develop strategies for monitoring and inhibiting AR-V7 in castration-resistant prostate cancer (CRPC). The purpose of this study was to understand whether other AR variants may be coexpressed with AR-V7 and promote resistance to AR-targeted therapies.<b>Experimental Design:</b>We utilized complementary short- and long-read sequencing of intact AR mRNA isoforms to characterize AR expression in CRPC models. Coexpression of AR-V7 and AR-V9 mRNA in CRPC metastases and circulating tumor cells was assessed by RNA-seq and RT-PCR, respectively. Expression of AR-V9 protein in CRPC models was evaluated with polyclonal antisera. Multivariate analysis was performed to test whether AR variant mRNA expression in metastatic tissues was associated with a 12-week progression-free survival endpoint in a prospective clinical trial of 78 CRPC-stage patients initiating therapy with the androgen synthesis inhibitor, abiraterone acetate.<b>Results:</b>AR-V9 was frequently coexpressed with AR-V7. Both AR variant species were found to share a common 3' terminal cryptic exon, which rendered AR-V9 susceptible to experimental manipulations that were previously thought to target AR-V7 uniquely. AR-V9 promoted ligand-independent growth of prostate cancer cells. High AR-V9 mRNA expression in CRPC metastases was predictive of primary resistance to abiraterone acetate (HR = 4.0; 95% confidence interval, 1.31-12.2;<i>P</i>= 0.02).<b>Conclusions:</b>AR-V9 may be an important component of therapeutic resistance in CRPC.<i>Clin Cancer Res; 23(16); 4704-15. ©2017 AACR</i>.",0.244
11100938,https://sysrev.com/p/70431/article/11100938,Circulating Cell-Free DNA to Guide Prostate Cancer Treatment with PARP Inhibition.,Cancer discovery,"Goodall, J.; Mateo, J.; Yuan, W.; Mossop, H.; Porta, N.; Miranda, S.; Perez-Lopez, R.; Dolling, D.; Robinson, DR.; Sandhu, S.; Fowler, G.; Ebbs, B.; Flohr, P.; Seed, G.; Rodrigues, DN.; Boysen, G.; Bertan, C.; Atkin, M.; Clarke, M.; Crespo, M.; Figueiredo, I.; Riisnaes, R.; Sumanasuriya, S.; Rescigno, P.; Zafeiriou, Z.; Sharp, A.; Tunariu, N.; Bianchini, D.; Gillman, A.; Lord, CJ.; Hall, E.; Chinnaiyan, AM.; Carreira, S.; de Bono, JS.","Biomarkers for more precise patient care are needed in metastatic prostate cancer. We have reported a phase II trial (TOPARP-A) of the PARP inhibitor olaparib in metastatic prostate cancer, demonstrating antitumor activity associating with homologous recombination DNA repair defects. We now report targeted and whole-exome sequencing of serial circulating cell-free DNA (cfDNA) samples collected during this trial. Decreases in cfDNA concentration independently associated with outcome in multivariable analyses (HR for overall survival at week 8: 0.19; 95% CI, 0.06-0.56;<i>P</i>= 0.003). All tumor tissue somatic DNA repair mutations were detectable in cfDNA; allele frequency of somatic mutations decreased selectively in responding patients (χ<sup>2</sup><i>P</i>< 0.001). At disease progression, following response to olaparib, multiple subclonal aberrations reverting germline and somatic DNA repair mutations (<i>BRCA2, PALB2</i>) back in frame emerged as mechanisms of resistance. These data support the role of liquid biopsies as a predictive, prognostic, response, and resistance biomarker in metastatic prostate cancer.<b>Significance:</b>We report prospectively planned, serial, cfDNA analyses from patients with metastatic prostate cancer treated on an investigator-initiated phase II trial of olaparib. These analyses provide predictive, prognostic, response, and resistance data with ""second hit"" mutations first detectable at disease progression, suggesting clonal evolution from treatment-selective pressure and platinum resistance.<i>Cancer Discov; 7(9); 1006-17. ©2017 AACR.</i><i>See related commentary by Domchek, p. 937</i><i>See related article by Kondrashova et al., p. 984</i><i>See related article by Quigley et al., p. 999</i><i>This article is highlighted in the In This Issue feature, p. 920</i>.",0.248
11100939,https://sysrev.com/p/70431/article/11100939,Clinical and Biological Characterisation of Localised High-risk Prostate Cancer: Results of a Randomised Preoperative Study of a Luteinising Hormone-releasing Hormone Agonist with or Without Abiraterone Acetate plus Prednisone.,European urology,"Efstathiou, E.; Davis, JW.; Pisters, L.; Li, W.; Wen, S.; McMullin, RP.; Gormley, M.; Ricci, D.; Titus, M.; Hoang, A.; Zurita, AJ.; Tran, N.; Peng, W.; Kheoh, T.; Molina, A.; Troncoso, P.; Logothetis, CJ.","Optimal therapeutic strategy remains an unmet need in localised high-risk prostate cancer (LHRPC). Androgen biosynthesis inhibition in the preoperative setting may improve outcomes. In this single-centre randomised trial, we looked at therapy outcomes of preoperative treatment with abiraterone acetate+prednisone (AAP)+luteinising hormone-releasing hormone agonist (LHRHa) or LHRHa alone followed by radical prostatectomy in 65 men. We did not see a significant difference of organ-confined carcinoma (p=0.27). However, tumour volume measures were significantly lower for AAP+LHRHa treatment (p≤0.001). Of note, lower tumour epithelium volume correlated with improved biochemical recurrence-free survival at ≥4-yr follow-up (p=0.0014). Tumours pretreated with AAP+LHRHa had lower proliferation and androgen signalling expression than LHRHa. On multivariate analysis, glucocorticoid receptor (GR) overexpression correlated with persistent tumours in AAP+LHRHa (p=0.018). The presence of nuclear androgen receptor splice variant (nARV7) correlated with persistent tumours in both arms. No new safety signals were observed. This is the first study investigating the role of preoperative AAP+LHRHa versus LHRHa alone in LHRPC. We report significant cytoreduction by tumour volume measures inversely correlating with biochemical relapse. Validation of these proposed tumour volume measures is planned. A potential role of GR in resistance to androgen biosynthesis inhibition warrants further study. PATIENT SUMMARY: This is the first study of abiraterone acetate plus leuprolide versus leuprolide alone in high-risk localised prostate cancer followed by prostatectomy. Patients in the combination arm had a significantly smaller tumour size.",0.280
11100940,https://sysrev.com/p/70431/article/11100940,"A First-Time-in-Human Study of GSK2636771, a Phosphoinositide 3 Kinase Beta-Selective Inhibitor, in Patients with Advanced Solid Tumors.",Clinical cancer research : an official journal of the American Association for Cancer Research,"Mateo, J.; Ganji, G.; Lemech, C.; Burris, HA.; Han, SW.; Swales, K.; Decordova, S.; DeYoung, MP.; Smith, DA.; Kalyana-Sundaram, S.; Wu, J.; Motwani, M.; Kumar, R.; Tolson, JM.; Rha, SY.; Chung, HC.; Eder, JP.; Sharma, S.; Bang, YJ.; Infante, JR.; Yan, L.; de Bono, JS.; Arkenau, HT.","<b>Background:</b>The PI3K/protein kinase B (AKT) pathway is commonly activated in several tumor types. Selective targeting of p110β could result in successful pathway inhibition while avoiding the on- and off-target effects of pan-PI3K inhibitors. GSK2636771 is a potent, orally bioavailable, adenosine triphosphate-competitive, selective inhibitor of PI3Kβ.<b>Methods:</b>We evaluated the safety, pharmacokinetics, pharmacodynamics and antitumor activity of GSK2636771 to define the recommended phase II dose (RP2D). During the dose-selection and dose-escalation stages (parts 1 and 2), patients with<i>PTEN</i>-deficient advanced solid tumors received escalating doses of GSK2636771 (25-500 mg once daily) using a modified 3+3 design to determine the RP2D; tumor type-specific expansion cohorts (part 3) were implemented to further assess tumor responses at the RP2D.<b>Results:</b>A total of 65 patients were enrolled; dose-limiting toxicities were hypophosphatemia and hypocalcemia. Adverse events included diarrhea (48%), nausea (40%), and vomiting (31%). Single- and repeat-dose exposure increased generally dose proportionally. GSK2636771 400 mg once daily was the RP2D. Phospho/total AKT ratio decreased with GSK2636771 in tumor and surrogate tissue. A castrate-resistant prostate cancer (CRPC) patient harboring<i>PIK3CB</i>amplification had a partial response for over a year; an additional 10 patients derived durable (≥24 weeks) clinical benefit, including two other patients with CRPC with<i>PIK3CB</i>alterations (≥34 weeks). GSK2636771 400 mg once daily orally induced sufficient exposure and target inhibition with a manageable safety profile.<b>Conclusions:</b>Genomic aberrations of<i>PIK3CB</i>may be associated with clinical benefit from GSK2636771.<i>Clin Cancer Res; 23(19); 5981-92. ©2017 AACR</i>.",0.290
11100941,https://sysrev.com/p/70431/article/11100941,"Randomized Phase II Study Evaluating Akt Blockade with Ipatasertib, in Combination with Abiraterone, in Patients with Metastatic Prostate Cancer with and without PTEN Loss.",Clinical cancer research : an official journal of the American Association for Cancer Research,"de Bono, JS.; De Giorgi, U.; Rodrigues, DN.; Massard, C.; Bracarda, S.; Font, A.; Arranz Arija, JA.; Shih, KC.; Radavoi, GD.; Xu, N.; Chan, WY.; Ma, H.; Gendreau, S.; Riisnaes, R.; Patel, PH.; Maslyar, DJ.; Jinga, V.","PURPOSE: PI3K-Akt-mTOR and androgen receptor (AR) signaling are commonly aberrantly activated in metastatic castration-resistant prostate cancer (mCRPC), with PTEN loss associating with poor prognosis. We therefore conducted a phase Ib/II study of the combination of ipatasertib, an Akt inhibitor, with the CYP17 inhibitor abiraterone in patients with mCRPC.<b>Patients and Methods:</b>Patients were randomized 1:1:1 to ipatasertib 400 mg, ipatasertib 200 mg, or placebo, with abiraterone 1,000 mg orally. Coprimary efficacy endpoints were radiographic progression-free survival (rPFS) in the intent-to-treat population and in patients with PTEN-loss tumors.

RESULTS: rPFS was prolonged in the ipatasertib cohort versus placebo, with similar trends in overall survival and time-to-PSA progression. A larger rPFS prolongation for the combination was demonstrated in PTEN-loss tumors versus those without. The combination was well tolerated, with no treatment-related deaths.

CONCLUSIONS: In mCRPC, combined blockade with abiraterone and ipatasertib showed superior antitumor activity to abiraterone alone, especially in patients with PTEN-loss tumors.<i>See related commentary by Zhang et al., p. 901</i>.",0.605
11100942,https://sysrev.com/p/70431/article/11100942,HSD3B1 (1245A>C) germline variant and clinical outcomes in metastatic castration-resistant prostate cancer patients treated with abiraterone and enzalutamide: results from two prospective studies.,Annals of oncology : official journal of the European Society for Medical Oncology,"Khalaf, DJ.; Aragón, IM.; Annala, M.; Lozano, R.; Taavitsainen, S.; Lorente, D.; Finch, DL.; Romero-Laorden, N.; Vergidis, J.; Cendón, Y.; Oja, C.; Pacheco, MI.; Zulfiqar, M.; Gleave, ME.; Wyatt, AW.; Olmos, D.; Chi, KN.; Castro, E.","BACKGROUND: A common polymorphism (1245A>C) in the HSD3B1 gene is associated with increased de novo synthesis of androgens and worse outcomes in men treated with androgen-deprivation therapy for metastatic castration-sensitive prostate cancer. The objective of the study was to determine whether this polymorphism is associated with outcomes for metastatic castration-resistant prostate cancer (mCRPC) treated with abiraterone or enzalutamide.

PATIENTS AND METHODS: A total of 547 patients treated with abiraterone or enzalutamide from two prospective cohorts were evaluated. The HSD3B1 genotype was determined by targeted sequencing and/or TaqMan single-nucleotide polymorphism genotyping. In cohort 1, patients were randomized to receive abiraterone + prednisone or enzalutamide. In cohort 2, patients received either agent according to investigator's choice. Prostate-specific antigen (PSA) response rate, time to PSA progression (TTPP), time to progression (TTP) and overall survival were determined. Associations between HSD3B1 genotypes and outcomes were evaluated via univariate Cox regression. Multivariable Cox model was used to determine the independent association of each covariate.

RESULTS: The HSD3B1 variant genotype (CC) was present in 15% of patients and was associated with worse TTP [hazard ratio (HR) 1.31, 95% confidence interval (CI) 1.02-1.67, P = 0.032] and PSA response rates (48% for CC versus 62% and 65% for AA and AC, respectively [P = 0.019]), with no significant difference in TTPP (HR 1.28, 95% CI 0.99-1.66, P = 0.064). The effect of genotype was similar for treatment with abiraterone or enzalutamide with a negative test for interaction for TTPP (P = 0.997) and TTP (P = 0.749). Multivariable analysis did not show a significant association between genotype and TTP or TTPP.

CONCLUSIONS: The HSD3B1 (CC) genotype was associated with shorter TTP and lower PSA response rate in patients with mCRPC treated with abiraterone or enzalutamide. However, the CC genotype did not provide prognostic information beyond that conferred by standard clinical variables, suggesting that it may not be a suitable stand-alone biomarker in mCRPC.",0.790
