Article ID,Article URL,Title,Journal,Authors,Abstract,predict(84239:Include)
11100913,https://sysrev.com/p/70431/article/11100913,"Serum Free Methylated Glutathione S-transferase 1 DNA Levels, Survival, and Response to Docetaxel in Metastatic, Castration-resistant Prostate Cancer: Post Hoc Analyses of Data from a Phase 3 Trial.",European urology,"Mahon, KL.; Qu, W.; Lin, HM.; Spielman, C.; Cain, D.; Jacobs, C.; Stockler, MR.; Higano, CS.; de Bono, JS.; Chi, KN.; Clark, SJ.; Horvath, LG.","BACKGROUND: Glutathione S-transferase 1 (GSTP1) expression is inactivated in >90% of all prostate cancers in association with aberrant DNA methylation. Detection of serum free methylated GSTP1 (mGSTP1) DNA is associated with overall survival (OS) and response to docetaxel in metastatic castration-resistant prostate cancer (mCRPC) in test and internal validation cohorts.

OBJECTIVE: To assess the relationship between serum free mGSTP1 and treatment outcomes in SYNERGY, a phase 3 multicentre randomised trial testing the addition of custirsen to first-line chemotherapy with docetaxel in mCRPC.

DESIGN, SETTING, AND PARTICIPANTS: Serum free mGSTP1 DNA was measured by a sensitive methylation-specific polymerase chain reaction assay in paired samples (baseline and after two cycles of docetaxel) from 600 patients.

OUTCOME MEASUREMENTS AND STATISTICAL ANALYSIS: Associations between serum free mGSTP1 at baseline, change in mGSTP1 after docetaxel, OS, and time to prostate-specific antigen (PSA) progression were examined using Cox proportional hazards models and Kaplan-Meier methods.

RESULTS AND LIMITATIONS: Serum free mGSTP1 was detectable at baseline in 458 (81%) patients. Of those with detectable mGSTP1 at baseline, mGSTP1 became undetectable after two cycles in 243 (53%). Undetectable mGSTP1 at baseline was associated with longer OS (hazard ratio [HR] 0.4, 95% confidence interval [CI] 0.29-0.55; p<0.00001). The event of mGSTP1 becoming undetectable after two cycles of chemotherapy was associated with longer OS (HR 0.36, 95% CI 0.29-0.46; p<0.00001) and longer time to PSA progression (HR 0.44, 95% CI 0.35-0.56; p<0.00001). Associations between mGSTP1 and clinical outcomes were independent of other established prognostic variables. Analysis was limited by the lack of radiographic progression-free survival data.

CONCLUSIONS: This is the first study to externally validate the prognostic role of a circulating epigenetic biomarker in mCRPC. Further studies are needed to validate serum free mGSTP1 as a surrogate endpoint for clinical trials and as a potential clinical decision tool.

PATIENT SUMMARY: In this study, we confirmed that a blood marker predicted outcomes after chemotherapy for metastatic prostate cancer. This marker may accelerate future clinical trials of new therapies and be useful in the clinic to guide treatment decisions.",0.441
11100914,https://sysrev.com/p/70431/article/11100914,A Phase 1 study of gefitinib combined with durvalumab in EGFR TKI-naive patients with EGFR mutation-positive locally advanced/metastatic non-small-cell lung cancer.,British journal of cancer,"Creelan, BC.; Yeh, TC.; Kim, SW.; Nogami, N.; Kim, DW.; Chow, LQM.; Kanda, S.; Taylor, R.; Tang, W.; Tang, M.; Angell, HK.; Roudier, MP.; Marotti, M.; Gibbons, DL.","BACKGROUND: EGFR tyrosine kinase inhibitors (TKIs) induce cytolysis and release of tumour proteins, which can stimulate antigen-specific T cells. The safety and efficacy of durvalumab and gefitinib in combination for TKI-naive patients with advanced EGFRm NSCLC was evaluated.

METHODS: This Phase 1 open-label, multicentre trial (NCT02088112) was conducted in 56 patients with NSCLC. Dose expansion permitted TKI-naive patients, primarily with activating L858R or Ex19del EGFRm. Arms 1 + 1a received concurrent therapy; Arm 2 received 4 weeks of gefitinib induction followed by concurrent therapy.

RESULTS: From dose escalation, the recommended dose of durvalumab was 10 mg/kg Q2W with 250 mg QD gefitinib. Pharmacokinetics were as expected, consistent with inhibition of soluble PD-L1 and no treatment-emergent immunogenicity. In dose expansion, 35% of patients had elevated liver enzymes leading to drug discontinuation. In Arms 1 + 1a, objective response rate was 63.3% (95% CI: 43.9-80.1), median progression-free survival (PFS) was 10.1 months (95% CI: 5.5-15.2) and median response duration was 9.2 months (95% CI: 3.7-14.0).

CONCLUSIONS: Durvalumab and gefitinib in combination had higher toxicity than either agent alone. No significant increase in PFS was detected compared with historical controls. Therefore, concurrent PD-L1 inhibitors with gefitinib should be generally avoided in TKI-naive patients with EGFRm NSCLC.",0.386
11100915,https://sysrev.com/p/70431/article/11100915,Association between variants in genes involved in the immune response and prostate cancer risk in men randomized to the finasteride arm in the Prostate Cancer Prevention Trial.,The Prostate,"Winchester, DA.; Till, C.; Goodman, PJ.; Tangen, CM.; Santella, RM.; Johnson-Pais, TL.; Leach, RJ.; Xu, J.; Zheng, SL.; Thompson, IM.; Lucia, MS.; Lippman, SM.; Parnes, HL.; Isaacs, WB.; De Marzo, AM.; Drake, CG.; Platz, EA.","BACKGROUND: We reported that some, but not all single nucleotide polymorphisms (SNPs) in select immune response genes are associated with prostate cancer, but not individually with the prevalence of intraprostatic inflammation in the Prostate Cancer Prevention Trial (PCPT) placebo arm. Here, we investigated whether these same SNPs are associated with risk of lower- and higher-grade prostate cancer in men randomized to finasteride, and with prevalence of intraprostatic inflammation among controls. Methods A total of 16 candidate SNPs in IL1β, IL2, IL4, IL6, IL8, IL10, IL12(p40), IFNG, MSR1, RNASEL, TLR4, and TNFA and 7 tagSNPs in IL10 were genotyped in 625 white prostate cancer cases, and 532 white controls negative for cancer on an end-of-study biopsy nested in the PCPT finasteride arm. We used logistic regression to estimate log-additive odds ratios (OR) and 95% confidence intervals (CI) adjusting for age and family history.

RESULTS: Minor alleles of rs2243250 (T) in IL4 (OR = 1.46, 95% CI 1.03-2.08, P-trend = 0.03), rs1800896 (G) in IL10 (OR = 0.77, 95% CI 0.61-0.96, P-trend = 0.02), rs2430561 (A) in IFNG (OR = 1.33, 95% CI 1.02-1.74; P-trend = 0.04), rs3747531 (C) in MSR1 (OR = 0.55, 95% CI 0.32-0.95; P-trend = 0.03), and possibly rs4073 (A) in IL8 (OR = 0.81, 95% CI 0.64-1.01, P-trend = 0.06) were associated with higher- (Gleason 7-10; N = 222), but not lower- (Gleason 2-6; N = 380) grade prostate cancer. In men with low PSA (<2 ng/mL), these higher-grade disease associations were attenuated and/or no longer significant, whereas associations with higher-grade disease were apparent for minor alleles of rs1800795 (C: OR = 0.70, 95% CI 0.51-0.94, P-trend = 0.02) and rs1800797 (A: OR = 0.72, 95% CI 0.53-0.98, P-trend = 0.04) in IL6. While some IL10 tagSNPs were associated with lower- and higher-grade prostate cancer, distributions of IL10 haplotypes did not differ, except possibly between higher-grade cases and controls among those with low PSA (P = 0.07). We did not observe an association between the studied SNPs and intraprostatic inflammation in the controls.

CONCLUSION: In the PCPT finasteride arm, variation in genes involved in the immune response, including possibly IL8 and IL10 as in the placebo arm, may be associated with prostate cancer, especially higher-grade disease, but not with intraprostatic inflammation. We cannot rule out PSA-associated detection bias or chance due to multiple testing.",0.255
11100916,https://sysrev.com/p/70431/article/11100916,Associations between polymorphisms in genes related to estrogen metabolism and function and prostate cancer risk: results from the Prostate Cancer Prevention Trial.,Carcinogenesis,"Tang, L.; Platek, ME.; Yao, S.; Till, C.; Goodman, PJ.; Tangen, CM.; Wu, Y.; Platz, EA.; Neuhouser, ML.; Stanczyk, FZ.; Reichardt, JKV.; Santella, RM.; Hsing, A.; Figg, WD.; Lippman, SM.; Thompson, IM.; Ambrosone, CB.","Substantial preclinical data suggest estrogen's carcinogenic role in prostate cancer development; however, epidemiological evidence based on circulating estrogen levels is largely null. Compared with circulating estrogen, the intraprostatic estrogen milieu may play a more important role in prostate carcinogenesis. Using a nested case-control design in the Prostate Cancer Prevention Trial (PCPT), we examined associations of genetic variants of genes that are involved in estrogen synthesis, metabolism and function with prostate cancer risk. A total of 25 potentially functional single nucleotide polymorphisms (SNPs) in 13 genes (PGR, ESR1, ESR2, CYP17A1, HSD17B1, CYP19A1, CYP1A1, CYP1B1, COMT, UGT1A6, UGT1A10, UGT2B7, UGT2B15) were examined in whites only. Controls (n = 1380) were frequency matched to cases on age, PCPT treatment arm, and family history (n = 1506). Logistic regression models adjusted for age and family history were used to estimate odds ratios (OR) and 95% confidence intervals (CI) separately in the placebo and finasteride arms. SNPs associated with prostate cancer risk differed by treatment arm. The associations appeared to be modified by circulating estrogen and androgen levels. CYP19A1 was the only gene harboring SNPs that were significantly associated with risk in both the placebo and finasteride arms. Haplotype analysis with all three CYP19A1 SNPs genotyped (rs700518, rs2445765, rs700519) showed that risk-allele haplotypes are associated with the increased prostate cancer risk in both arms when comparing with the non-risk allele haplotype. In conclusion, associations between SNPs in estrogen-related genes and prostate cancer risk are complex and may be modified by circulating hormone levels and finasteride treatment.",0.270
11100917,https://sysrev.com/p/70431/article/11100917,Clinical and Genomic Characterization of Treatment-Emergent Small-Cell Neuroendocrine Prostate Cancer: A Multi-institutional Prospective Study.,Journal of clinical oncology : official journal of the American Society of Clinical Oncology,"Aggarwal, R.; Huang, J.; Alumkal, JJ.; Zhang, L.; Feng, FY.; Thomas, GV.; Weinstein, AS.; Friedl, V.; Zhang, C.; Witte, ON.; Lloyd, P.; Gleave, M.; Evans, CP.; Youngren, J.; Beer, TM.; Rettig, M.; Wong, CK.; True, L.; Foye, A.; Playdle, D.; Ryan, CJ.; Lara, P.; Chi, KN.; Uzunangelov, V.; Sokolov, A.; Newton, Y.; Beltran, H.; Demichelis, F.; Rubin, MA.; Stuart, JM.; Small, EJ.","Purpose The prevalence and features of treatment-emergent small-cell neuroendocrine prostate cancer (t-SCNC) are not well characterized in the era of modern androgen receptor (AR)-targeting therapy. We sought to characterize the clinical and genomic features of t-SCNC in a multi-institutional prospective study. Methods Patients with progressive, metastatic castration-resistant prostate cancer (mCRPC) underwent metastatic tumor biopsy and were followed for survival. Metastatic biopsy specimens underwent independent, blinded pathology review along with RNA/DNA sequencing. Results A total of 202 consecutive patients were enrolled. One hundred forty-eight (73%) had prior disease progression on abiraterone and/or enzalutamide. The biopsy evaluable rate was 79%. The overall incidence of t-SCNC detection was 17%. AR amplification and protein expression were present in 67% and 75%, respectively, of t-SCNC biopsy specimens. t-SCNC was detected at similar proportions in bone, node, and visceral organ biopsy specimens. Genomic alterations in the DNA repair pathway were nearly mutually exclusive with t-SCNC differentiation ( P = .035). Detection of t-SCNC was associated with shortened overall survival among patients with prior AR-targeting therapy for mCRPC (hazard ratio, 2.02; 95% CI, 1.07 to 3.82). Unsupervised hierarchical clustering of the transcriptome identified a small-cell-like cluster that further enriched for adverse survival outcomes (hazard ratio, 3.00; 95% CI, 1.25 to 7.19). A t-SCNC transcriptional signature was developed and validated in multiple external data sets with > 90% accuracy. Multiple transcriptional regulators of t-SCNC were identified, including the pancreatic neuroendocrine marker PDX1. Conclusion t-SCNC is present in nearly one fifth of patients with mCRPC and is associated with shortened survival. The near-mutual exclusivity with DNA repair alterations suggests t-SCNC may be a distinct subset of mCRPC. Transcriptional profiling facilitates the identification of t-SCNC and novel therapeutic targets.",0.239
11100918,https://sysrev.com/p/70431/article/11100918,"A phase I, open-label, two-stage study to investigate the safety, tolerability, pharmacokinetics, and pharmacodynamics of the oral AKT inhibitor GSK2141795 in patients with solid tumors.",Investigational new drugs,"Aghajanian, C.; Bell-McGuinn, KM.; Burris, HA.; Siu, LL.; Stayner, LA.; Wheler, JJ.; Hong, DS.; Kurkjian, C.; Pant, S.; Santiago-Walker, A.; Gauvin, JL.; Antal, JM.; Opalinska, JB.; Morris, SR.; Infante, JR.","Background We sought to determine the recommended phase II dose (RP2D) and schedule of GSK2141795, an oral pan-AKT kinase inhibitor. Patients and Methods Patients with solid tumors were enrolled in the dose-escalation phase. Pharmacokinetic (PK) analysis after a single dose (Cycle 0) informed dose escalation using accelerated dose titration. Once one grade 2 toxicity or dose-limiting toxicity was observed in Cycle 1, the accelerated dose titration was terminated and a 3 + 3 dose escalation was started. Continuous daily dosing was evaluated along with two intermittent regimens (7 days on/7 days off and 3 times per week). In the expansion phase at RP2D, patients with endometrial or prostate cancer, as well as those with select tumor types with a PIK3CA mutation, AKT mutation or PTEN loss, were enrolled. Patients were evaluated for adverse events (AEs), PK parameters, blood glucose and insulin levels, and tumor response. Results The RP2D of GSK2141795 for once-daily dosing is 75 mg. The most common (>10%) treatment-related AEs included diarrhea, fatigue, vomiting, and decreased appetite. Most AEs were low grade. The frequency of hyperglycemia increased with dose; however, at the RP2D, grade 3 hyperglycemia was only reported in 4% of patients and no grade 4 events were observed. PK characteristics were favorable, with a prolonged half-life and low peak-to-trough ratio. There were two partial responses at the RP2D in patients with either a PIK3CA mutation or PTEN loss. Conclusion GSK2141795 was safe and well-tolerated, with clinical activity seen as monotherapy at the RP2D of 75 mg daily. NCT00920257.",0.206
11100919,https://sysrev.com/p/70431/article/11100919,Targeting Androgen Receptor and DNA Repair in Metastatic Castration-Resistant Prostate Cancer: Results From NCI 9012.,Journal of clinical oncology : official journal of the American Society of Clinical Oncology,"Hussain, M.; Daignault-Newton, S.; Twardowski, PW.; Albany, C.; Stein, MN.; Kunju, LP.; Siddiqui, J.; Wu, YM.; Robinson, D.; Lonigro, RJ.; Cao, X.; Tomlins, SA.; Mehra, R.; Cooney, KA.; Montgomery, B.; Antonarakis, ES.; Shevrin, DH.; Corn, PG.; Whang, YE.; Smith, DC.; Caram, MV.; Knudsen, KE.; Stadler, WM.; Feng, FY.; Chinnaiyan, AM.","Purpose To determine whether cotargeting poly (ADP-ribose) polymerase-1 plus androgen receptor is superior to androgen receptor inhibition in metastatic castration-resistant prostate cancer (mCRPC) and whether ETS fusions predict response. Patients and Methods Patients underwent metastatic site biopsy and were stratified by ETS status and randomly assigned to abiraterone plus prednisone without (arm A) or with veliparib (arm B). Primary objectives were: confirmed prostate-specific antigen (PSA) response rate (RR) and whether ETS fusions predicted response. Secondary objectives were: safety, measurable disease RR (mRR), progression-free survival (PFS), and molecular biomarker analysis. A total of 148 patients were randomly assigned to detect a 20% PSA RR improvement. Results A total of 148 patients with mCRPC were randomly assigned: arm A, n = 72; arm B, n = 76. There were no differences in PSA RR (63.9% v 72.4%; P = .27), mRR (45.0% v 52.2%; P = .51), or median PFS (10.1 v 11 months; P = .99). ETS fusions did not predict response. Exploratory analysis of tumor sequencing (80 patients) revealed: 41 patients (51%) were ETS positive, 20 (25%) had DNA-damage repair defect (DRD), 41 (51%) had AR amplification or copy gain, 34 (43%) had PTEN mutation, 33 (41%) had TP53 mutation, 39 (49%) had PIK3CA pathway activation, and 12 (15%) had WNT pathway alteration. Patients with DRD had significantly higher PSA RR (90% v 56.7%; P = .007) and mRR (87.5% v 38.6%; P = .001), PSA decline ≥ 90% (75% v 25%; P = .001), and longer median PFS (14.5 v 8.1 months; P = .025) versus those with wild-type tumors. Median PFS was longer in patients with normal PTEN (13.5 v 6.7 months; P = .02), TP53 (13.5 v 7.7 months; P = .01), and PIK3CA (13.8 v 8.3 months; P = .03) versus those with mutation or activation. In multivariable analysis adjusting for clinical covariates, DRD association with PFS remained significant. Conclusion Veliparib and ETS status did not affect response. Exploratory analysis identified a novel DRD association with mCRPC outcomes.",0.251
11100920,https://sysrev.com/p/70431/article/11100920,Olaparib for Metastatic Castration-Resistant Prostate Cancer.,The New England journal of medicine,"de Bono, J.; Mateo, J.; Fizazi, K.; Saad, F.; Shore, N.; Sandhu, S.; Chi, KN.; Sartor, O.; Agarwal, N.; Olmos, D.; Thiery-Vuillemin, A.; Twardowski, P.; Mehra, N.; Goessl, C.; Kang, J.; Burgents, J.; Wu, W.; Kohlmann, A.; Adelman, CA.; Hussain, M.","BACKGROUND: Multiple loss-of-function alterations in genes that are involved in DNA repair, including homologous recombination repair, are associated with response to poly(adenosine diphosphate-ribose) polymerase (PARP) inhibition in patients with prostate and other cancers.

METHODS: We conducted a randomized, open-label, phase 3 trial evaluating the PARP inhibitor olaparib in men with metastatic castration-resistant prostate cancer who had disease progression while receiving a new hormonal agent (e.g., enzalutamide or abiraterone). All the men had a qualifying alteration in prespecified genes with a direct or indirect role in homologous recombination repair. Cohort A (245 patients) had at least one alteration in<i>BRCA1</i>,<i>BRCA2</i>, or<i>ATM</i>; cohort B (142 patients) had alterations in any of 12 other prespecified genes, prospectively and centrally determined from tumor tissue. Patients were randomly assigned (in a 2:1 ratio) to receive olaparib or the physician's choice of enzalutamide or abiraterone (control). The primary end point was imaging-based progression-free survival in cohort A according to blinded independent central review.

RESULTS: In cohort A, imaging-based progression-free survival was significantly longer in the olaparib group than in the control group (median, 7.4 months vs. 3.6 months; hazard ratio for progression or death, 0.34; 95% confidence interval, 0.25 to 0.47; P<0.001); a significant benefit was also observed with respect to the confirmed objective response rate and the time to pain progression. The median overall survival in cohort A was 18.5 months in the olaparib group and 15.1 months in the control group; 81% of the patients in the control group who had progression crossed over to receive olaparib. A significant benefit for olaparib was also seen for imaging-based progression-free survival in the overall population (cohorts A and B). Anemia and nausea were the main toxic effects in patients who received olaparib.

CONCLUSIONS: In men with metastatic castration-resistant prostate cancer who had disease progression while receiving enzalutamide or abiraterone and who had alterations in genes with a role in homologous recombination repair, olaparib was associated with longer progression-free survival and better measures of response and patient-reported end points than either enzalutamide or abiraterone. (Funded by AstraZeneca and Merck Sharp & Dohme; PROfound ClinicalTrials.gov number, NCT02987543.).",0.335
11100921,https://sysrev.com/p/70431/article/11100921,Phase II pilot study of the prednisone to dexamethasone switch in metastatic castration-resistant prostate cancer (mCRPC) patients with limited progression on abiraterone plus prednisone (SWITCH study).,British journal of cancer,"Romero-Laorden, N.; Lozano, R.; Jayaram, A.; López-Campos, F.; Saez, MI.; Montesa, A.; Gutierrez-Pecharoman, A.; Villatoro, R.; Herrera, B.; Correa, R.; Rosero, A.; Pacheco, MI.; Garcés, T.; Cendón, Y.; Nombela, MP.; Van de Poll, F.; Grau, G.; Rivera, L.; López, PP.; Cruz, JJ.; Lorente, D.; Attard, G.; Castro, E.; Olmos, D.","BACKGROUND: Despite most metastatic castration-resistant prostate cancer (mCRPC) patients benefit from abiraterone acetate plus prednisone 5 mg bid (AA + P), resistance eventually occurs. Long-term use of prednisone has been suggested as one of the mechanisms driving resistance, which may be reversed by switching to another steroid.

METHODS: SWITCH was a single-arm, open-label, single-stage phase II study. The primary objective was to evaluate the antitumour activity of abiraterone acetate plus dexamethasone 0.5 mg daily (AA + D) in mCRPC patients progressing to AA + P. Clinically stable mCRPC patients who had prostate-specific antigen (PSA) and/or limited radiographic progression after at least 12 weeks on AA + P, were eligible. The primary endpoint was measured as the proportion of patients achieving a PSA decline of  ≥ 30% (PSA30) from baseline after 6 weeks on AA + D. Secondary endpoints included: PSA50 response rate at 12 weeks, time to biochemical and radiological progression, overall survival, safety profile evaluation, benefit from subsequent treatment lines and the identification of biomarkers of response (AR copy number, TMPRSS2-ERG status and PTEN expression).

RESULTS: Twenty-six patients were enrolled. PSA30 and PSA50 were 46.2% and 34.6%, respectively. Median time to biochemical and radiological progression were 5.3 and 11.8 months, respectively. Two radiological responses were observed. Median overall survival was 20.9 months. Patients with AR gain detected in plasma circulating tumour DNA did not respond to switch, whereas patients with AR normal status benefited the most. No significant toxicities were observed and PSA50 response rate to subsequent taxane was 50%.

CONCLUSIONS: In selected clinical stable mCRPC patients with limited disease progression on AA + P, a steroid switch from prednisone to dexamethasone can lead to PSA and radiological responses.",0.508
11100922,https://sysrev.com/p/70431/article/11100922,A prospective genome-wide study of prostate cancer metastases reveals association of wnt pathway activation and increased cell cycle proliferation with primary resistance to abiraterone acetate-prednisone.,Annals of oncology : official journal of the European Society for Medical Oncology,"Wang, L.; Dehm, SM.; Hillman, DW.; Sicotte, H.; Tan, W.; Gormley, M.; Bhargava, V.; Jimenez, R.; Xie, F.; Yin, P.; Qin, S.; Quevedo, F.; Costello, BA.; Pitot, HC.; Ho, T.; Bryce, AH.; Ye, Z.; Li, Y.; Eiken, P.; Vedell, PT.; Barman, P.; McMenomy, BP.; Atwell, TD.; Carlson, RE.; Ellingson, M.; Eckloff, BW.; Qin, R.; Ou, F.; Hart, SN.; Huang, H.; Jen, J.; Wieben, ED.; Kalari, KR.; Weinshilboum, RM.; Wang, L.; Kohli, M.","Background: Genomic aberrations have been identified in metastatic castration-resistant prostate cancer (mCRPC), but molecular predictors of resistance to abiraterone acetate/prednisone (AA/P) treatment are not known.

Patients and methods: In a prospective clinical trial, mCRPC patients underwent whole-exome sequencing (n = 82) and RNA sequencing (n = 75) of metastatic biopsies before initiating AA/P with the objective of identifying genomic alterations associated with resistance to AA/P. Primary resistance was determined at 12 weeks of treatment using criteria for progression that included serum prostate-specific antigen measurement, bone and computerized tomography imaging and symptom assessments. Acquired resistance was determined using the end point of time to treatment change (TTTC), defined as time from enrollment until change in treatment from progressive disease. Associations of genomic and transcriptomic alterations with primary resistance were determined using logistic regression, Fisher's exact test, single and multivariate analyses. Cox regression models were utilized for determining association of genomic and transcriptomic alterations with TTTC.

Results: At 12 weeks, 32 patients in the cohort had progressed (nonresponders). Median study follow-up was 32.1 months by which time 58 patients had switched treatments due to progression. Median TTTC was 10.1 months (interquartile range: 4.4-24.1). Genes in the Wnt/β-catenin pathway were more frequently mutated and negative regulators of Wnt/β-catenin signaling were more frequently deleted or displayed reduced mRNA expression in nonresponders. Additionally, mRNA expression of cell cycle regulatory genes was increased in nonresponders. In multivariate models, increased cell cycle proliferation scores (≥ 50) were associated with shorter TTTC (hazard ratio = 2.11, 95% confidence interval: 1.17-3.80; P = 0.01).

Conclusions: Wnt/β-catenin pathway activation and increased cell cycle progression scores can serve as molecular markers for predicting resistance to AA/P therapy.",0.326
